№,Качество
58,"Страх изменений. Все, что меняется, вызывает панику и страх. Сопротивляются трансформациям из-за своих внутренних качеств. Не хотят выходить из зоны комфорта.  "
59," Умение видеть масштаб, мыслить масштабно, взвешивая риски и возможности безграничных платформ и систем (и государственные границы и масштабирование того, что создается). Цифровой дубликат не стоит ничего, отсюда риски и возможности. Как изменить стандарты индустрии. Sky is your limit"
59,"Живут в заданных рамках. Люди, которые мыслят границами своего подразделения/отдела/департамента/компании/индустрии. Реагируют на проблему, не действуют проактивно.  "
60," Умеют сказать сложное простым языком. Используют чувство юмора как инструмент доверительных коммуникаций. Способность быстро сопоставлять, делать краткие и емкие замечания. Быстро из контекста происходящего выдернуть суть, и обернуть в фантик. Остроумие в коммуникациях."
60,"Говорят скучно, бюрократическим языком, научным языком, не умеют удерживать внимание, и снижать напряжение. При общении с ними не возникает чувства доверия.  "
61," Прозрачная приоритезация (что попадет в следующий релиз). Все завязано на текущий ресурс разработки. Важно фокусироваться правильно. Важно в цифре особенно, так как сервисы завязаны друг на друга. Нужно правильно понимать, куда направлять ресурсы. Нужно балансировать между мотивацией сотрудников/бизнеса/стейкхолдеров. "
61,"Хвататься за все. Не получится сделать все сразу. Если пытаться все сразу сделать, то не получится ничего. Не понятно, за что браться в первую очередь, хаос и отсутствие качественных результатов.  "
62," Умение работать с IT-стартапами как генераторами новых идей, инкубаторами, стартап-скаутинг, talant-скаутинг. Умение работать именно с такими командами, умение вдохновлять и коучить ребят, которые организуют стартапы, а иногда и подстегивать.  Multigenerationl подход, умение выглядеть релевантным для молодых поколений, адекватный для этого поколения performance managment. "
62,"Авторитарность, директивность, формализм, административность, инновационным хабом невозможно управлять директивно, стартапы будут убегать, или не будут замотивированы.  "
63," Продуктовое визионерство: не только что будет, но и что НЕ будет востребовано. Понимание необходимости строить стратегию не на cash cow (при всем уважении к ним). Чувствительность к рискам и возможностям."
63,Традиционализм в области организации работы 
64," Заточен на сотрудничество в компании, достижение своих результатов нетоксичными способами. Важно как добиваться цели. Этичность"
64,"Идет напролом, важен результат любой ценой. Этика на втором плане "
65," Развитие продукта через customer journey (от того, что нужно клиенту)"
65,"Развитие продукта исходя из того,  что уже есть в Компании. Умеем это делать и будем развивать. "
66," Опыт участия в проектах построения информационных систем, который приводит к глубокому пониманию принципов построения таких систем."
66,Отсутствие понимания базовых принципов построения информационных систем 
67," Высокая скорость мышления, погружение в новые области, умение нырять в любую предметную область и там уже быстро соображать. "
67,"Неспособность изучать что-то новое, неспособность воспринимать новую информацию.  "
68," Эмпатия, умение понимать эмоции людей и уважать их, человеколюбие, без этого трудно извлекать максимальный творческий потенциал из людей. "
68,"Считают, что все люди плохие и лентяи, по умолчанию не любят людей, не волнуют чувства и мысли сотрудников, интересуют человекочасы. Относятся к айтишникам как к строителям или землекопам, что в этой сфере это не очень работает.  "
69, Адаптивность к окружающей среде. 
69,"Ограниченность своим предыдущим опытом, косность.  "
70," Умение находить неординарные решения, и управленческие, и технические. Способность находить решения, которые до тебя никто не находил."
70,Шаблонное мышление. Неспособность генерировать уникальные решения.  
71," Способность управлять глубиной своего стратегического мышления. Умеет как мечтать, так и оперировать среднесрочными перспективами. Оперирует образом будущего, которого еще не существует. "
71,"Мыслит категориями и задачами сегодняшнего дня. Максимально ограничен, не думает вперед. Максимум шкалы планирования ограничен коротким промежутком времени. "
72," Умение оперировать цифрами, мыслить статистическими и вероятностными категориями. Способность оцифровывать события и объекты реального мира и на основе этого принимать решения. "
72,"Мыслить только категорией чувств, эмоций, ощущений, вдохновений. Не способен или не привык перекладывать реальность на цифру в процессе мышления, и использовать это в принятии решений.  "
73," Интеллект. Быстрый ум, умение обрабатывать большой объем информации и выхватывать суть. Четко формулировать проблему. Умение делать правильные выводы. Гибкость. Умение перестраиваться и понимать свою неправоту. Curiosity, кругозор в профессиональной среде. Learning agility. Незашоренность."
73,Экспертиза вглубь. Меньшая скорость и гибкость интеллекта. Накопленная экспертиза. 
74," Умение ""продать"" идею, завести народ вокруг. Умение вовлечь. Готовность трансформировать идею на основе фидбека."
74,"Опора на административные инструменты, а не на то, чтобы убедить, сопровождающееся полной уверенностью в своей правоте. Важно донести видение. "
75, Гибкость и скорость мышления и действий. Готовность быстро воплощать решения.
75,"Согласование с политикой, концепцией. Длительная оценка качества решений перед воплощением. "
76, Чуваки из интернета. Digital native.
76,Finance native. 
77," Про продукт. Важно что-то создать для людей, которое поменяет жизнь этих людей."
77,Про личные амбиции и любовь к компании. Важен бизнес-успех. 
78," Серый кардинал, политик."
78,Амбиция и харизма. 
79," С фокусом на человека (сотрудника). Ориентация на удержание и развитие сотрудников, но то, чтобы сотрудники вовлекались."
79,"Жесткий. Эмоции людей вторичны. Не стесняются увольнять, менять оргструктуру. "
80," Инициирует большое количество коммуникаций. Чем больше у человека нетворкинг в своей профессиональной сфере, тем больше возможностей для него это генерирует"
80,"Ведет закрытый образ жизни, затворник, в своей скорлупе, бронзовеет, не происходит трансформации мышления, соответственно не растет внутренне, сложно создавать актуальные продукты "
81," Лучше умеет управлять рисками. Чаще берется за рискованные мероприятия. Оценивает риски и возможности, и готов пробовать, искать новые возможности. "
81,"Между рисками и возможностями, пытается максимально себя обезопасить. Предпочитают оставить все как есть, пусть работает, как работает. Лучше будет терпеть неудобства, чем пробовать что-то новое. Залезть в домик, обезопасить себя. "
82," Высокий уровень зрелости. Широта кругозора в целом, широта взглядов. Разбирается не только в своей предметной области, но и в сопутствующих областях. Количество собственного пережитого опыта, разнообразие нетиповых проблем, с которыми сталкиваются."
82,"Низкий уровень зрелости. Разбирается пусть даже и хорошо, но в своей предметной области, о других областях знает только в теории. Однообразный жизненный опыт, в одном замкнутом контексте, например на одной позиции, в одном городе, в одной отрасли, в одной функциональной сфере.  "
83," Знание методологий. Есть типовые фреймворки, например проектные или продуктовые. Знание базовых управленческих принципов в основе этих фреймворков позволяет запускать любые продукты и проекты. Если я обучился им и попробовал, то я смогу масштабировать эти знания на любые продукты/проекты."
83,"Незнание методологий. Если принципиально не знает, как устроена проектная или продуктовая деятельность, сложно управлять процессами создания или созидания чего-либо. Без базового понимания принципов построения проектов, любе ресурсы будут тратиться неэффективно.  "
84," Готовность к изменениям. Внешняя среда всегда изменяется, нет такого успешного бизнеса, который бы не подстраивался под внешние изменения. Должен оценивать внешние изменения и подстраивать свой бизнес под них"
84,"Неготовность к изменениям. Закукливаются под влиянием внешних изменений, и не вносят изменения в свой бизнес под внешним влиянием. "
85," Создает команду, умеет делегировать. Умеет мотивировать людей и делать из них команды для решения конкретной задачи. Понимают, какого человека, куда поставить, чтобы это было эффективно и для человека и для решения задачи. Здесь как раз помогает широкий нетворкинг"
85,"Неумение создавать команды и делегировать. Решение любого уровня задач  (стратегического, операционного и пр) решается только единолично. Микроменеджмент. Ставит неправильных людей на неправильную позицию, не мэтчит задачу и скиллы человека. "
86, Умеют выстраивать взаимоотношения с людьми и разбираются в политике принятия решений
86,"Не умеют договариваться с людьми и не понимают, с кем нужно дружить, а с кем нужно конкурировать. "
87," Принятие решений на уровне цифр и фактов. Изучаются факты, цифры и логики перед принятием решений. Постоянный учет новых обстоятельств даже в типовых процессах."
87,"Решения на уровне регламентов, выработанных годами. Опора на готовые процессы и решения. ""Так исторически сложилось"" "
88," Готовность к изменениям. Поиск новых возможностей для улучшений, поиск возможностей, рассмотрение нескольких сценариев развития. Вариативность, в том числе по отношению к образу результата."
88,"Довольствуется достигнутым, нет тяги к новым достижениям. Стремление к четкому результату. (10000 банок в сутки) "
89," Амбициозность, стремление к результатам, которые, возможно, превышают текущие возможности. Постоянный поиск возможностей, ресурсов и инструментов для решений."
89,Довольствуется текущими достигнутыми результатами. Новые инструменты и возможности начинает рассматривать только если уже перестали работать старые. 
90," Четкая и широкая картина будущего на 2-5 лет вперед, построенная на фактах. Смотрит на картину всего мира и свое место в ней.  Визионер. Есть связь между картиной будущего и планом ее достижения."
90,"Четкая, но узкая картина будущего, не захватывает сферы вокруг. Смотрит на конкретный рынок. "
91," Не считают команду инструментом. Считают, что команду нужно растить, развивать, мотивировать, что эмоциональное состояние команды важно. Индивидуальный подход к членам команды. Опираются на команду как на основной ресурс."
91,"Команда как инструмент. Отсутствие индивидуализации, четкие регламенты, которые не учитывают личностные особенности членов команд. (Все должны писать правой рукой) "
92," Верит в цифровые инструменты. Понимает ценность классических инструментов и видит, как цифровые и классические инструменты могут дополнять друг друга. Умеет оцифровать эффективность классических инструментов."
92,"Желание работать только с классическими инструментами. Рассматривает диджитал инструменты как факультативный инструмент, не видит в них ценности. "
93," Доверие и открытость к команде: доверяют больше информации, больше рассказывают команде. Отсутствие микроменеджмента. Делегирование задач."
93,"Микроменеджмент. Не дают ""лишней"" информации команде. Отсутствие погружения команды в более высокоуровневую задачу. "
94," Человечность, общается со всеми на одном уровне. Не делает ранжирования по уровню компетенций и статуса. Стремится принимать командные решения."
94,"Особое внимание к статусу. Подход ""Я начальник, ты - дурак/ты начальник, я - дурак"". Директивное принятие решений. "
95," Подбирает в команду таких людей, которые компенсируют слабые черты самого топа."
95,"Подбирает команды, стремясь закрыть текущие задачи, дыры, ""горящие"" вещи. "
96," Гибкость, адаптируемость под текущие условия рынка. Готовность принимать нестандартные решения."
96,Ценность - показать свою компетентность через уже отработанные инструменты. 
97, Четкость и организованность. 
97,"Отсутствие процессов, дезорганизованность, неструктирированность.  "
98," Эффективная работа с данными. Умение отличать зерна от плевел. Понимает на какие данные реально можно основываться, а какие для вида. Данные надежные, собранные из достоверных источников, могут служить основой для принятия решения. "
98,"Неэффективная работа с данными. Поверхностный подход к работе с данными, небрежность в отношении надежности информации. Не умеет распознать некачественные данные при выработке управленческих решений. "
99," Цифровая грамотность. Знание современных (цифровых) методов, технологий и процессов применяемых в бизнесе. "
99,"Отрицание эффективности цифровых процессов в пользу классических методов, иногда устаревших. Отсутствие цифровой грамотности.  "
100," Умение принимать своевременные решения. Управленческая смелость, берет на себя ответственность за принятые решения. Ownership. "
100,"Управленческая нерешительность. Сложность в принятии решения, затягивание решения, возврат к предыдущим версиям.  "
101," Визионерство. Смотрит в будущее, мыслит категориями будущего. Forward-looking and future-oriented. Планирование желаемого результата. ""Мы хотим сделать 200, и мы думаем, что нам нужно для того, чтобы сделать 200"". Прорывные действия."
101,"Консерватизм. Основывается на предыдущих результатах. Планирование от достигнутого. ""Мы в прошлом году сделали 100, в следующем, значит, будем делать 105"". Небольшие шаги. "
102," Сильный лидер, собирающий команду сильных партнеров, а не подчиненных.  Дает свободу команде, но строго спрашивает с них и себя."
102,"Собирает команду людей, которые от него зависят (""смотрят им в рот"", не требовательны к результату и себе. Четкая иерархия подчинённости.  "
103, Развитие подчиненных и саморазвитие как ценность. Культура непрерывных улучшений. Развитие - приоритет.
103,"Консервативная основа на существующих знаниях, небрежность в освоении нового. Все равно, будут ли подчиненные развиваться или нет. Иногда даже препятствие развитию подчиненных в угоду текущим задачам.  "
104," Сильный продакт-оунер, понимает цикл создания и развития продукта, его технические характеристики в связи с потребительской ценностью"
104,"Думает о технической стороне вопроса, а не о потребителе (думает о том, сколько усилий уйдет на починку того, что сломается) "
105," Умеет слушать аргументацию в пользу изменения решения о продукте, открыт к альтернативным точкам зрения"
105,"Имеет свое строгое виденье того, как должно быть (я художник, я так вижу) "
