№,Качество
106," Идеалист, перфекционист, отличник, ""ботан"". Внимателен к деталям. Много учился и хотел быть в этом идеален. Фокус на красоту."
106,"Не важны детали, важно, чтобы быстро и недорого. Закрывают глаза на качество не основных элементов интерфейса. Нет скрупулезного причесывания мелочей. "
107," Могут просто, доходчиво объяснять сложные технические вещи не профессионалу. Быстро строят понятные модели сложной реальности, ориентируясь на собеседника"
107,Уход в технические подробности при объяснении (несмотря на стеклянный взгляд собеседника). Не умеет и не стремится структурировать информацию для другого. 
108," Человек смог успешно освоить две области знаний, поженить маркетинг, road to customer и IT-бэкграунд, цифровой опыт"
108,Проваливается client orientation или tech skills 
109," Ценность личной экспертизы и включенности. Не только управленец, но и хороший профессионал-специалист. Сидит с командой и разбирается в причинах, по которым дело не идет. Неклассический менеджер, а старший среди равных."
109,"Может не быть экспертом, не вовлеченным в специфику продукта, ставить формальные задачи команде. Управляет по PDCA. "
110," Умение работать с неопределенностью, неполными данными, нечетко заданными ориентирами, стратегией и т.п. Готовы рисковать и принимать решение, исходя из неполных данных. Готовы к провалам."
110,"Бездействуют в ситуации отсутствия вводных. Низкая толерантность к неопределенности. Дискомфортно работать, пока нет всех вводных. Долго принимает решение, пытаясь учесть полный набор данных. Не готовы к провалу. "
111," Толерантность к критике. Готов ошибаться, и его это не убивает."
111,Ошибка равносильна смерти. 
112," Высокий интеллект: широкий кругозор, способность обобщать и делать исследовательскую работу, просчитывают разные стратегии. За каждым решением стоит сложная система вычислений. Работа ""в конструкторском бюро"", работа с концепцией."
112,"Оперативно решают в срок рутинные задачи. Хорошо координируют и договариваются. Могут быстро принимать ситуативные решения. Работа ""начальника цеха"" с опорой на готовые знания. "
113," Хваткие коммуникативно, сильны в личной беседе, знают тонкости корпоративной политики, похожи на российских государственных чиновников. "
113,"Прямой,  ничего не понимает в корпоративной политике. Командный, состоит в искренних и доверительных взаимоотношениях с командой, отсутствуют подковерные игры.  "
114," Сильная команда замов, много инициативы. Доверительные отношения, контроль по KPI, а не по процессам. Контроль того, что важно, а не того, как сделано. Спокойно относится к тому, что подчиненные превосходят по компетенциям, старается подбирать именно таких людей. "
114,"Все на личном контроле, не умеет делегировать. Когда кто-то проявляет серьезную инициативу, которая не соответствует ожиданиям топа, будет скандал. Наказывающая корпоративная культура. Все друг друга перепроверяют все время, пытаются делать все по правилам. Авторитарность управления. Неуверенно чувствует себя с людьми, которые превосходят по компетенциям, так как не может перепроверить результат, и боится, что подсидят.  "
115," Успешен за счет хорошей школы жизни и предпринимательского склада ума. Сделал себя сам за счёт своей гибкости, оперативности, многозадачности, изобретательности. "
115,"Успешен за счет образования и корпоративной подготовки, тренинги, коучинги и пр. Есть понимание того, как работает большая корпорация, когда это публичная компания и есть западные владельцы. Здоровая корпоративность, не та, которая утяжеляет бизнес, а та, которая накладывает свои условия. Наличие MBA.  "
116," Стартап-мышление, важно понимать, что такое MVP, custdev, market fit, pivot (постоянная боевая трансформация продукта), agile, backlog и пр. Специфичная разработка продукта и специфичное управление разработкой. "
116,Отсутствие навыков управления продуктовой разработкой 
117," Продажа за счет связей, большая записная книжка, ""сходить в баню"", все на сильных личных связях. Публичность в социальных сетях, умение торговать лицом. Может начать разговор с того: ""что ты можешь у меня купить"", ""чем можешь быть полезен"". Дельцы в хорошем и плохом смысле"
117,"Продажа за счет качества продукта. Больше внимания уделяет продукту, качеству, эффективности, порядку.  "
118," Системность и последовательность. Способность ясно и структурированно выражать свои мысли, цели, задачи. "
118,Истеричность в принятии решений и непоследовательность в их реализации. 
119," Адекватность. Здравая и прагматичная оценка ситуации, совершает действия сообразно внешним условиям. Создание сценариев и выбор сценария, возможность своих действий. "
119,"Неадекватная оценка времени и ситуации, действия исходя из собственных соображений, без учета внешних обстоятельств, неправильная оценка последствий. Непредсказуемость, неуверенность, поведение, не соответствующее текущему моменту времени. Агрессивное невежество. "
120," Энергия созидания, способность вдохновлять, заряжать. "
120,"Унылая какашка. Всегда все плохо, всегда нытье. Негативное настроение.  "
121," Длинный горизонт планирования. Игра в долгую, думать на перспективу. "
121,"Короткий горизонт планирования. Решения сиюминутные, выгода в моменте, рвачество.  "
122," Эмпатия. Умение располагать, стремление достигнуть ситуации win-win, договороспособность. "
122,"Пренебрежительность, уничижительность, ультимативность, ""я всегда прав"", не задумывается о том, как он будет воспринят.  "
123," Способность принимать сложные решения (долгосрочные, высокорисковые, затрагивающие интересы людей; ответственные), проактивность в принятии решений. "
123,"Поиск легкого пути, избегание принятия решения, надежда, что все само собой разрешится (""Авось пронесет"",  ""Я в домике""), не рисковать, перекладывать сложные вопросы на других.  "
124," Лидерство. Способность вдохновлять и заряжать, мобилизовывать "
124,Директивность 
125," Позиция ""вместе"". Локомотив, который тащит. Не говорит, что знает ""как"", нам бы тут приехать, давайте вместе думать, как там оказаться"
125,"Позиция ""сверху"". ""Иди делай, сам разберись, тебя же для этого и нанимали"" "
126," Видение будущего мира как цифрового. Понимание, как это привнести в ту или иную индустрию, что это улучшит. Цифровизация - неизбежность."
126,"Не видит, как цифровые технологии могут улучшить бизнес, видит риски, что может поломаться уже работающая система, но не видит явных преимуществ. Полны рисков, сомнений и непонимания. Боятся изменить то, что и так уже хорошо работает. "
127," Лидер, который постоянно обучается. Цифровизация – это непрерывное обучение. Способность обучаться. Должно быть понимание, что тебе всегда не хватает знаний. "
127,"Лидер, который все знает, знает как устроен мир. Достаточность фундаментального образования.  "
128," Вера в электричество. Не боятся и верят, что электричество будет всегда. Мир цифровой. "
128,"Организаторы аналоговых процессов. Уверены, что выживут и без электричества. Ценность выстраивания процессов так,  чтобы они выживали без электричества.  "
129," Расторможенность. Готовы с головой бездумно бросаться на инновации, делать, бежать, зарабатывать, долго не думают перед тем как действовать. Оппортунисты, используют возможности. Левая часть кривой Роджерса."
129,"Заторможенность. Долго думают, сомневаются, критично оценивают себя и идеи, настороженно относятся к инновациям, видят риски. Правая кривой Роджерса.  "
130," Есть свое уникальное видение и есть смелость воплощать это видение в жизнь, несмотря на мнение общественности."
130,"Оглядка на рынок, что подумают и скажут люди, так не принято.  "
131," Установка: ""цифровой мир безопасен. А там где не безопасен, я знаю как обезопасить."""
131,"Установка: ""цифровой мир не безопасен, поэтому я в него не пойду."" "
132," Все равно как общаться, готовы общаться как угодно (онлайн или оффлайн) в любых условиях, самолете, баре и пр."
132,"Есть потребность в физическом общении, личном контакте. Общение только в очном формате, классические бизнес-встречи, общение тет-а-тет.  "
133, Agile: попробовали-проанализировали. Динамическое построение бизнеса. Готовы гибко подстраивается под рынок и его меняющиеся потребности. 
133,"Полное отсутствие agile подхода в классическом бизнесе. Консервативный подход к построению бизнес-процессов. Не умеют гибко перестраиваться, не принимают инновации, делают по-старому.  "
134," Любознательность. Стремление к познанию нового. Болезненная и непрекращающаяся тяга к новым знаниям. Каждый раз это область знания, которую ты до этого не изучал никогда. Постоянное расширение познания из самых разных сфер. Новые увлечения, новые рынки, новые знания, новые гипотезы. "
134,"Изучают только то, что непосредственно связано с текущим бизнесом. Идут в новые области знаний, только если экспертное профессиональное сообщество рекомендует идти в конкретную область, когда нет выбора.  "
135," Воображение. Визуализация процессов, так как цифра материализует виртуальный мир. Фаундер, чтобы построить бизнес он визуализирует весь процесс от создания бэкенда и фронтенда до логистики, он умеет увидеть целую картину, а потом раздать сотрудникам части этого для исполнения. Видят онлайн и оффлайн как единое пространство. "
135,"Видят меньшую часть бизнеса, не могут вообразить себе нематериальную часть, визуализировать ее. Смотрят на IT-составляющую как отдельный сегмент бизнеса, ""прицеп"". Видят оффлайн и онлайн как два пространства, как-то взаимодействующие друг с другом.  "
136," Более четкий подход. При построении бизнеса в виртуальном пространстве, нужно четко, понятно, доступно поставить задачу. Формулировка задач в письменном виде, всегда можно уточнить формулировку, и рамки постановки задач, что делает постановку задач более правильно и конкретной. Письменный follow-up по любой договорённости. "
136,"Классический бизнес постановка задач сводится к устным разговорам. Чёткость в устной постановке задачи верна на 60%. С вероятностью на 60% она будет выполнена так, как задумывал руководитель.  "
137," Созидание. Стремятся сделать счастливыми большое количество людей через удовлетворение их запросов и потребностей. Воодушевление и вера в свой продукт, зарабатывание денег не самоцель.  "
137,Зарабатывание денег. Зацикливается на PNL 
138," Отношение к кризису – ""время возможностей"""
138,"Отношение к кризису – ""все плохо, все пропало"" "
139," Способность анализировать большое количество информации: куда двигается цифра (сфера расползается очень широко). Постоянная обучаемость, открытость новому. (Чтобы не создавать за свои деньги либо уже существующее, либо мертворожденное)"
139,"Гиперсистемность. Процедура важнее результата. Интерес к тому, что уже есть в существующем бизнесе. Глубокое знание существующих механизмов работы системы в компании. Ориентация на ключевые показатели, расставленные в процессе. "
140," Инженерная, технологическая грамотность. Умение формулировать ТЗ. Четко понимать, чем
одна технология отличается от другой. Какие основы лежат за той или иной
технологией."
140,"Полная лояльность, клановость, семейность. Ориентация на эмоции, отношения, доверие. Для того чтобы разбираться в технологиях нанимаются специальные ""люди в очках"". "
141,Проверка гипотез. Это стоит денег и требует времени. Готовность к отрицательному результату. Активная генерация самых разных гипотез.
141,"Подстраивать гипотезу под желаемое. Выбирать гипотезу, которая сулит карьерный рост. Хайпануть на гипотезе. Популизм при формулировании гипотез и нежелание проверять ""неприятные"" (с этой гипотезой к начальнику даже не подходи)."
142,Целеполагание под существующую нишу и потенциально доращиваемую до эффективного решения технологию. Открытая рамка с четко заданным видением продукта.
142,Целеполагание по итогам анализа рынка прошлого периода с утверждением четкого коридора целевых значений.
143," Хирш, соцсети, публичные технологизированные рейтинги, конференции, прямая "
143,"Деньги любят тишину. В сети раскручивается бренд, а не конкретный человек, личность. СМИ-стратегии пиара. Инфоповоды. "
144," Деликатность, забота об интересах конечного пользователя на фоне понимания необходимости подстраиваться под интересы регуляторов. Репутация, уверенность потребителя в том, что система работает в их интересах, а не использует пользователей для своих целей. (При этом сбор данных гуглом ок, т.к. данные деперсонализированы, и это часть бизнеса). Решать задачи не в ущерб персональному пользователю. Работа в интересах конечного пользователя, а не государства."
144,"Деньги не пахнут. Все, что в интересах бизнеса, полезно.  Торговля на фоне напряженных отношений. Снабжение солдат Вермахта как яркий пример. Потребитель важен как тот, кто голосует рублем. "
145," Не бояться рисковать. Готовность потратить время, деньги и репутацию на то, во что веришь."
145,"Недопустимость рисков, поскольку они повлекут за собой нарушение стабильного поступательного движения и процесса выработки эффективных стратегий, обрастания связями и т.п. "
146," Формирование большого количества коммуникаций, которые позволяют видеть тренды, новости, обогащаться знаниями."
146,"Интроверсия, закрытость, оберегание себя и бизнеса от незнакомцев. Свои кружки, сокращение коммуникаций до узкого круга с критерием полезности и безопасности. "
147," Безусловные авторитеты, пионеры в проектах, за которые берутся. Если такой человек анонсирует проект, все понимают, что это будет что-то новое, революционное, заслуживающее внимания."
147,"Ассоциируется с классическим продуктом. Но в его рамках могут возникать новые характеристики, которые выводят продукт в новую нишу, формируют новое качество потребления. Интерпретация и новая глубина. "
148," Технологии как смысл жизни. Погруженность в цифровой рынок, отслеживание технологических трендов во всех проявлениях (гаджеты, языки, законодательство, влияние технологий на мир). Не имеет значения, нравится ли гаджет, но он новый и значит нужен."
148,"Технологии как инструмент. Изучение прикладных инструментов решения задач с помощью технологий. Внимание к практичным решениям, нет одержимости технологиями. "
149,  Тотальное уважение к людям. Работаешь с людьми как с равными себе. Умеют слушать и слушаться сотрудников любого уровня. Ставишь задачу непосредственно исполнителю.
149,"Жесткая субординация. Не принимает информации от сотрудника, который ниже тебя хотя бы на 2 ступеньки. Ты можешь поставить задачу только руководителю ниже себя. Требуются согласования от компетентных подразделений. "
