№,Качество
150," Результат важнее инструкции/процесса. Умение строить процессы так,, чтобы выдавать результат с наименьшим количеством касаний и наибольшей автоматизацией. Чем прямее, тем лучше. Если нужна ручка, иди напрямую к кладовщику. У исполнителей д.б. возможность принимать решения в рамках полномочий."
150,"Выстраивание процессов на основе согласований. На каждой точке процесса есть исполнитель и тот, кто подтверждает обоснованность требуемого действия. "
151," Доверие команде, людям. Уметь тотально доверять. Ты не можешь проверить код за разработчиками) Нет шансов выстроить контрольные точки.Исполнитель несет ответственность и по умолчанию за ним не смотрит еще один чел."
151,"Выстроенные точки управленческого контроля. Регламентное управление. Исполнитель делает работу, руководитель проверяет и его еще раз проверяют. "
152," Свобода личности, демократические инструменты управления. Давать возможность людям быть самими собой. Свобода слова, вероисповедания, гендера. Умение выстраивать такую среду. Прав умный."
152,"Царизм, авторитарный стиль управления (и подчинения). Как я сказал, так и правильно. Власть сильного, а не умного.  Как начальник скажет, так и будет. Ты - начальник, я дурак. "
153," Я и ты уникальны, и это круто. Запаренность на корпоративной культуре и наличии смыслов, размышлений, рефлексии ценностей, развивающейся снизу идеологии. Социальный смысл бизнеса. Инклюзивность, дайверсити. Собирать очень разных людей и объединять, играть на разности потенциалов. Свобода поведения человека. Не мы нанимаем, а нас выбрали у нас поработать."
153,"Единые стандарты поведения, мышления, проявлений. Унификация сознания. Я такой же, как и ты, ты такой же, как и я. Ориентация на простые ответы про людей. Прогноз поведения сотрудников. "
154," Скорость принятия и реализации решений в условиях неопределенности.  Навыки делегирования.Определенности никогда не было и до пандемии. Быстро приняли решение, а потом его обеспечиваем инфраструктурой. Решения принимаются не навсегда. Итерационность. Если что откатимся назад. Внимание к обратной связи от людей."
154,"Долгое взвешивание и согласование решений. Решения принимаются ""навсегда"", ""полностью продуманное"". Попытка продумать за людей. Нет готовности отменить решение. Очень сложно откатить назад. "
155," Умение ""продавать"" идеи, задачи, миссию. Работа с возражениями, отработка аргументов,... рассмотрение собственных сотрудников как клиентов.Формулировка должна рождать поле для дискуссии, разные отклики и интерпретации. Важно провоцировать дискуссии как источник обратной связи."
155,"Умение приказывать. Навык быть директивным. Четкие формулировки. Ответственность за сказанное. Внимательность к формулировкам, чтобы не было двусмысленности. Важно не спровоцировать дискуссии, т.к. это может быть в буквальном смысле опасно. "
156," Тотальная вера в идею, которую реализуешь. То, что ты делаешь - на уровне религии. Поэтому просто объяснять и поэтому за тобой идут люди. Не все равно, чем управлять."
156,"Вера в инструменты (управления, бизнеса). Мне все равно, чем управлять. Вера то, что управленческий инструментарий одинаков в любой сфере. "
157," Нарушение/развитие канонов. Изобретение велосипедов/космических ракет (экономических моделей, клиентского сервиса и т.п.). Создание нового, стремление минимизировать шаблоны. Мы не такие как все. Все используют, значит нам не надо."
157,"Стереотипное, шаблонное мышление. Шаблонов может быть много, но они шаблоны. Нетерпимость к дилетантству и экспериментам. Каноническое мышление. Если все так делают, то и мне надо. "
158," Упрощение любых моделей процессов до максимально применимых. Упрощение оценки, принятия бюджета и т.п. до минимально необходимой для принятия решений. Постоянная оптимизация. Сравнимо с компактными моделями бизнес-школ. Главное - чтобы было понятно. Простая модель может работать сама, но всегда подразумевает коммуникацию."
158,"Чем более витиеватая модель, чем больше в ней подтверждающих вывод переменных, тем лучше. Громоздкость, нужны несколько доказательств одного и того же. Много и непонятно. Хочется получить ответы на все вопросы без коммуникации и на основе готовой сложной модели. "
159," Умение видеть картинку вне цифрового мира. Кругозор. Умение дезинтегрировать целостную картинку на конечный набор факторов и построить из них что-то новое, что будет адекватно внешнему миру."
159,"Размытая картина мира, где нет деталей, но есть особая чувствительность. (Мир близорукого человека без очков: вижу, что что-то происходит, но не очень понятно, что именно) "
160," Какая-то часть жизни связана с интересом к цифровым инструментам, прикольно что-то цифровое протестировать на себе"
160,Нет интереса к цифровым инструментам 
161," Конкретность, ""бесконечное количество раз задавать вопрос ""чтобы что?"". Конкретная коммуникация, конкретное целеполагание. Умеют договориться о конкретном результате. Умение операционализировать показатели, выражать их в цифрах."
161,Умеет нарисовать большую картинку абстрактными методами. Широкие критерии. 
162," Эволюционировать вместе с продуктом и наращивать новые C-ролей. Понимание того, что является продуктом. Понимание того, для чего ты работаешь. Эволюция продукта с расширением карты стейкхолдеров. Смотреть на один шаг дальше, видеть больший контекст и использовать это видение для развития. Брать на себя новые роли."
162,"Ответственность за вверенный участок, ориентация на то, что уже умеешь хорошо делать. "
163," Виденье, широта кругозора, holistic view, многоаспектное видение ситуации, исходить не только из KPI, но и из далекой цели"
163,"Ограниченность, ориентация на тактические задачи "
164," Вижу цель, не вижу препятствий"
164,"Сам себя ограничивает блокерами, фиксируется на помехах "
165, Ставит и отслеживает задачи от и до
165,Делегирует 
166, Хорошо коммуницируют One to few
166,Хорошо коммуницируют One to many 
167," Замалчивает обратную связь, с трудом дает ОС в глаза"
167,Открыто дает обратную связь 
168," Лидер-одиночка: привык полагаться на себя, на новом месте работают с новыми людьми. Не оказывают никому максимальное доверие"
168,"Командный лидер: сплачивает вокруг себя команду единомышленников, управляет ей. Движется по карьерной лестнице со своей командой.  Не видит себя вне команды "
169," Стремление узнать что-то новое извне и использовать в своей сфере, обогащение экспертизы"
169,"Максимальное изучение текущего, своих задач, углубление экспертизы "
170," Не используют инструменты нетворкинга. Не любят социальной стороны жизни. Считают себя профессионалами и так, не нуждающимися в социализации"
170,"Социальность как задача: создают и монетизируют связи через соцсети, тусовки, выступления. Важно быть в круге единомышленников и этим пользоваться "
171," Embrace of novelty: открытость к эксперименту, не боязнь инновации, "
171,"Традиционность, консерватизм "
172, Виденье: clear focus on the future despite of obstacles and clarity on actions to achieve the future status
172,Нежелание менять статус-кво 
173," Бутиковость (маленький масштаб, personal comfort in the center)"
173,"Амбиции делать что-то революционное, идти против шерсти, turn around "
174," Установка на отработку гипотезы ""Скорость решений, быстрые результаты без страха ошибки"""
174,"Установка без права на ошибку ""Лучше делать так, чтобы не ошибаться (а это требует времени)"" "
175," Открытость к оценке, калибровка себя, оценка как путь к успеху"
175,"Боязнь узнать о себе настоящем, уязвимость к оценочным инструментам "
176," Учиться самим у лучших и внедрять лучшие практики, life-long learning, networking, effective communication"
176,"Живущий внутри своей моносистемы, застрявший в одном направлении "
177, Вера в вероятностные технологии
177,"Цинизм, вызванный опытом,  обесценивание технологий, основанных на вероятностном прогнозировании и данных "
178, Сотрудничество с данными (cooperation with the big data analysis)
178,"Конкуренция с данными, противопоставление себя данным "
179," Доступность, искренняя открытость, присутствие в соцсетях как активный инструмент коммуникации (лично пишет, выступает, отвечает). "
179,"Формальность, закрытость в общении, ""встречи по записи"" "
180, Высокая learning agility
180,Низкая learning agility 
181," Видят возможные решения, которые повлияют на изменения текущих процессов, на смотря на сложности внедрения и непопулярность, принесут улучшения. "
181,"Ориентируются на выполнение процессов ""по старинке"", не замечают новых возможностей.  "
182," Умеют слышать предложения других по внедрению чего-то нового, спокойно к этому относятся, открыты к диалогу и аргументам. "
182,"Изначальное враждебное отношение к идеям, будут искать недостатки в идеях других,  эмоционально спорить и находить пути отказа от этих идей. "
183," Когда работают с данными и бенчмарками сфокусированы на информации которая challenge their views. Пытаются открыть для себя что-то новое, измениться. В информации, которая противоречит их установкам видят возможности. "
183,"В данных или бенчмарках сфокусированы на поиске подтверждения. того, что ""у нас все хорошо"" или ""мы выбрали правильную стратегию"". Анализируют через призму - ""подтвердить статус кво"". "
184," Легче идет на риск, быстрее готов инвестировать, даже если отдача не совсем предсказуема. (В цифровом бизнесе больше рисков)"
184,"Важна безопасность, стабильность, следование правилам.  "
185," Гибко реагирует на изменения среды, установки не ""диктуют"" решения."
185,"Работает по своим ""шаблонам"", установкам, трудно меняет свои установки, когда они перестают соответствовать среде. (adaptability). Не могут осознать, что установка устарела "
186, Одинаково общаются с разными уровнями сотрудников. Не обращают внимания на иерархию. Открыты к неформальному общению со всеми.
186,"Выстраивание взаимодействия в зависимости от иерархии бизнеса. Если ты ниже по иерархии, нужно официально встречу поставить. Общение очень формальное, по протоколу, сухо и официозно. "
187," Видят гораздо дальше, чем традиционный бизнес.  Видение, идеи могут выглядеть безумно и футуристично, но они потом срабатывают. Трендсеттер"
187,"Короткий горизонт видения, более традиционное, в рамках текущих трендов.  "
188," Способность не просто говорить об изменениях, но и проводить их в жизнь, понимать как эти изменения  трансформируются в корпоративную отчетность"
188,"Непонимание как цифровая трансформация может улучшить бизнес показатели, отсутствие опыта таких трансформаций, отсутствие запроса и понимания как это может повлиять на изменения бизнеса к лучшему "
189," Клиентоцентричность. Персонификация контакта с клиентами, накопление больших данных. формулирование профиля клиента, и возможность выстраиваться более качественную коммуникацию. Все это стало возможным благодаря цифровой трансформации."
189,"Ориентация на бухгалтерию и документооборот. Замыкаются внутри своей бизнесовой скорлупки, не понимают, что хочет их клиент, не анализируют клиента. Бизнесов близорукость, анализ происходит на уровне бухучета  "
190," Отсутствие шор, открытость к новому. ""Вижу цель, не вижу препятствий"", ориентация на результат, драйв. "
190,"Усталость, неверие, отсутствие успешного опыта. Если ни разу руками успех не делал, ты будешь идти в темной комнате с небольшим фонариком. Выученная беспомощность.  "
191," Системность. Укладывают в структуру, календари, процессы, распределение задач по команде, и последовательное отслеживание результата, применение правильных инструментов управления. "
191,"Управление по наитию, без четкого понимания инструментария, не зацикливаясь, кто будет исполнять, как, и какой результат это принесет "
192," Цифровая структурность: умеют от идеи перейти к четкому пониманию продукта, умеют операционализировать идеи: сколько времени уйдет на кодинг, какая архитектура, понимают, какие современные инструменты есть для воплощения идеи. "
192,"Мечтатели, генераторы идей "
193," Важно собрать и удерживать правильную команду, с необходимыми навыками, люди с духом предпринимательства, которые готовы брать на себя ответственность. Быть в постоянном контакте с ними, обучать, умение вдохновлять, ставить интересные задачи, заботиться о команде, отсеивать дурных овец. "
193,"Относится к людям как ресурсу, ""ты уйдешь, другого наймем"".  "
194," Налаживают систему, которая позволяет быть команде в том числе совете директоров все время в курсе новых цифровых технологий и формировать из этого инициативы. Лидерство, просветительство, технологическая повестка. "
194,"Функционеры. Низкая готовность внедрять новые прорывные технологии. Важно внедрять только те технологии, которые зарекомендовали себя на рынке. Стратегия избегания рисков.  "
195," Системность мышления. Взгляд на картинку целиком, строит причинно-следственные связи, работает с причиной, а не следствием."
195,"Смотрит не дальше своего носа. Слишком локальные решения. Только здесь и сейчас. Тушит только локальные пожары, не смотрит в суть проблемы, не решает ее системно.  "
196,"  Скорость принятия решения: умеет быстро думать, даже говорить, как индикатор быстроты мышления. Умеет взвесить все факторы, влияющие на ситуацию, готов взять ответственность и принять решение. "
196,"Неумение увидеть все влияющие факторы на ситуацию, взвесить эти факторы, и взять ответственность на принятие решение, и оперативное его принять.  "
197, Понимание всего цикла разработки цифрового продукта. 
197,"Разрозненные знания в понимании, как рождается и запускается продукт. Знания там, знания сям, но не системные "
198," Умение разговаривать с цифровыми людьми, понимание ментальности IT-людей и умение общаться с ними на одном языке. Понимание их мотивации (""продать"" идею человеку, чтобы он пришел, и чтобы не уходил)"
198,Отсутствие индивидуального подхода к сотрудникам с техническим мышлением 
199," Умение смотреть на рынок и примерять тенденции рынка на свой бизнес, видеть риски и возможности, и уметь имплицировать это на свой бизнес. "
199,"Зашоренность, неумение анализировать рынок и адаптироваться под него "
200," Умение выстраивать архитектуру системы, и отслеживать изменения в этом поле, живая система, один раз отстроить мало. Например, в любой момент может понадобиться переносить сервера из-за политической ситуации в стране. "
200,"Недальновидность в плане работы с данными, серверной архитектуры. Очень рискованная, например плохо рассчитана нагрузка, просто в одной стране с недружелюбным законодательством, неудачный софт.  "
201," Люди, которые под тобой – растут. Не задавливает людей, а делает так, чтобы у людей крылья вырастали, не микроменеджерит, не завязывает все процессы на себя, дает развивающие задачи. "
